{
  "profile": "friday-omp",
  "harness": "kodemeio-omp",
  "principal": "agent:friday-omp",
  "roles": [
    "developer"
  ],
  "default_model": "openai-codex/gpt-6-luna",
  "small_model": "openai-codex/gpt-6-luna",
  "optional_worker_model": "deepseek/deepseek-flash",
  "provider_transport": "direct",
  "automatic_paid_fallback": false,
  "production_access": false,
  "publication": "operator-only-draft-pr",
  "max_parallel_workers": 2,
  "wall_clock_minutes": 45,
  "activation": "remote-deepseek-codex-pending",
  "default_thinking_level": "max",
  "small_thinking_level": "max",
  "optional_worker_thinking_level": "xhigh",
  "optional_worker_api_effort": "max"
}
